id,title,description,price,image_link,link,availability,condition,brand,product_type
US-43112-02,PROTECTOR SOLAR 50 SPF (facial y corporal) - 150 g.,"Formulado con ingredientes 100% naturales, NATURNUA presenta una fórmula innovadora para su protector solar SPF 35 y SPF 50. Elaborado con una mezcla de filtros físicos que garantizan una protección segura frente al espectro UVA y UVB. Además, son muy resistentes al agua con la certificación de VERY WATER RESISTANT. Los filtros usados para la formulación son el óxido de zinc y el dióxido de titanio. Ambos son minerales naturales que, por su opacidad, actúan a modo de pantalla, bloqueando la absorción de la radiación solar e impidiendo que llegue a la piel. Por su naturaleza son capaces de reflejar y dispersar la luz, actuando de forma eficaz sobre la radiación solar. El protector solar SPF 35 y SPF 50 son unas cremas protectoras de origen mineral que no solo protege nuestra piel de las radiaciones solares, sino que, además, hidrata y repara la piel. Esto es debido a que incorpora en su formulación ingredientes como el aloe vera y aceite de aguacate que ayudan a reparar y mantener la piel hidratada. Su textura facilita la extensión y absorción del producto, dejando la piel sin brillos y sin grasa. Indicado para todo tipo de pieles.",33.00 EUR,https://anitapinturitas.es/assets/productos/cuidadoPiel/solar2.jpg,https://anitapinturitas.es/html/producto.html?id=US-43112-02,in stock,new,Anita Pinturitas,Línea solar
US-43112-03,PROTECTOR SOLAR 30 SPF (facial y corporal) - 150 g.,"Formulado con ingredientes 100% naturales, NATURNUA presenta una fórmula innovadora para su protector solar SPF 35 y SPF 50. Elaborado con una mezcla de filtros físicos que garantizan una protección segura frente al espectro UVA y UVB. Además, son muy resistentes al agua con la certificación de VERY WATER RESISTANT. Los filtros usados para la formulación son el óxido de zinc y el dióxido de titanio. Ambos son minerales naturales que, por su opacidad, actúan a modo de pantalla, bloqueando la absorción de la radiación solar e impidiendo que llegue a la piel. Por su naturaleza son capaces de reflejar y dispersar la luz, actuando de forma eficaz sobre la radiación solar. El protector solar SPF 35 y SPF 50 son unas cremas protectoras de origen mineral que no solo protege nuestra piel de las radiaciones solares, sino que, además, hidrata y repara la piel. Esto es debido a que incorpora en su formulación ingredientes como el aloe vera y aceite de aguacate que ayudan a reparar y mantener la piel hidratada. Su textura facilita la extensión y absorción del producto, dejando la piel sin brillos y sin grasa. Indicado para todo tipo de pieles.",31.00 EUR,https://anitapinturitas.es/assets/productos/cuidadoPiel/solar3.jpg,https://anitapinturitas.es/html/producto.html?id=US-43112-03,in stock,new,Anita Pinturitas,Línea solar
US-43112-04,ACEITE BRONCEADOR NATURAL - 200 ml.,Magnífico aceite bronceador con aceites naturales de aguacate y zanahoria. Ayuda a conseguir un bronceado intenso y duradero.,19.00 EUR,https://anitapinturitas.es/assets/productos/cuidadoPiel/solar4.jpg,https://anitapinturitas.es/html/producto.html?id=US-43112-04,in stock,new,Anita Pinturitas,Línea solar
US-43112-05,ACELERADOR DEL BRONCEADO (Rayos UVA) - 200 ml.,Excelente aceite para acelerar el bronceado de la piel en centros del bronceado. Produce un bronceado uniforme y no provoca manchas en la piel.,15.00 EUR,https://anitapinturitas.es/assets/productos/cuidadoPiel/solar5.jpg,https://anitapinturitas.es/html/producto.html?id=US-43112-05,in stock,new,Anita Pinturitas,Línea solar
US-51111-01,BALSAK TIBETHAN - 50 ml.,"Excelente bálsamo tibetano a base de aceite de hierbas naturales, aceites esenciales y ceras naturales. Indicado para toda clase de masajes musculares, lumbalgias, cervicales, dolores de espalda, dolores musculares, etc.",19.00 EUR,https://anitapinturitas.es/assets/productos/cuidadoPiel/masajista1.jpg,https://anitapinturitas.es/html/producto.html?id=US-51111-01,in stock,new,Anita Pinturitas,El rincón del masajista
US-5112-02,BALSAK TIBETHAN PLUS (pulverizable) - 100 ml.,"Excelente bálsamo a base de principios activos vegetales y silicio orgánico, actúa ayudando a tratar las molestias musculares y articulares. El silicio orgánico, unido a los activos vegetales, favorece la recuperación de problemas musculares.",23.00 EUR,https://anitapinturitas.es/assets/productos/cuidadoPiel/masajista2.jpg,https://anitapinturitas.es/html/producto.html?id=US-5112-02,in stock,new,Anita Pinturitas,El rincón del masajista
US-51112-03,NATURPIEL - 50 ml.,"Mezcla magistral de ceras naturales, aceites vegetales y aceites esenciales, especial para aliviar irritaciones, rozaduras, escoceduras, dermatitis, descamaciones, etc. Con caléndula, germen de arroz, rosa mosqueta, árnica, hipérico, aceite de oliva, vitamina E, aceite esencial de lavanda y romero.",19.00 EUR,https://anitapinturitas.es/assets/productos/cuidadoPiel/masajista3.jpg,https://anitapinturitas.es/html/producto.html?id=US-51112-03,in stock,new,Anita Pinturitas,El rincón del masajista
US-51112-04,"TINTURA DE TOMILLO, ROMERO Y ÁRNICA - 150 ml.","Tintura pura extraída con métodos tradicionales y artesanos. Indicada para friegas y para favorecer al terapeuta en el tratamiento de los problemas musculares, articulares, falta de tono muscular, etc.",19.00 EUR,https://anitapinturitas.es/assets/productos/cuidadoPiel/masajista4.png,https://anitapinturitas.es/html/producto.html?id=US-51112-04,in stock,new,Anita Pinturitas,El rincón del masajista
US-51112-05,HARPAGOFITO Y ALOE VERA - 200 ml.,"Excelente gel de harpagofito con aloe vera, de rápida absorción. El extracto de harpagofito es conocido por sus innumerables propiedades en los campos del masaje y la fisioterapia.",19.00 EUR,https://anitapinturitas.es/assets/productos/cuidadoPiel/masajista5.jpg,https://anitapinturitas.es/html/producto.html?id=US-51112-05,in stock,new,Anita Pinturitas,El rincón del masajista
US-51112-06,LINIMENTO TIBETANO (efecto calor) - 200 ml.,Excelente linimento efecto calor. Formulado especialmente para preparar el sistema muscular de los deportistas proporcionándoles un calor suave que facilita el precalentamiento para evitar posibles lesiones.,17.00 EUR,https://anitapinturitas.es/assets/productos/cuidadoPiel/masajista6.jpg,https://anitapinturitas.es/html/producto.html?id=US-51112-06,in stock,new,Anita Pinturitas,El rincón del masajista
US-51112-07,ACEITE PARA MASAJE RELAJANTE - 200 ml.,"Aceite especial para personas tensas, con stress y nerviosismo. Los aceites esenciales proporcionan calma y serenidad tanto a nivel cutáneo actuando sobre las terminaciones nerviosas como a nivel olfativo.",17.00 EUR,https://anitapinturitas.es/assets/productos/cuidadoPiel/masajista7.jpg,https://anitapinturitas.es/html/producto.html?id=US-51112-07,in stock,new,Anita Pinturitas,El rincón del masajista
US-51112-08,ACEITE PARA MASAJE DESCONTRACTURANTE - 200 ml.,"Sensacional aceite para masaje descontracturante, por su composición ayuda al profesional a descontracturar la musculatura tensa y contraída tanto por el trabajo como por el deporte. Especial para fisioterapeutas, masajistas, etc.",17.00 EUR,https://anitapinturitas.es/assets/productos/cuidadoPiel/masajista8.jpg,https://anitapinturitas.es/html/producto.html?id=US-51112-08,in stock,new,Anita Pinturitas,El rincón del masajista
US-51112-09,SALES DE BAÑO EPSON RELAJANTE (lavanda y rosa mosqueta) - 1 kg.,"Sales de baño Epson enriquecidas con aceite de rosa mosqueta, aceite esencial de lavanda y aceite de almendras dulces. Las sales de baño ricas en Magnesio, unido a los efectos hidratantes y nutritivos de los aceites, aportan una serie de efectos beneficiosos para la piel además de ser relajantes.",33.00 EUR,https://anitapinturitas.es/assets/productos/cuidadoPiel/masajista9.jpg,https://anitapinturitas.es/html/producto.html?id=US-51112-09,in stock,new,Anita Pinturitas,El rincón del masajista
US-51112-10,SALES DE BAÑO EPSON SPORT (Árnica y gaulteria) - 1 kg.,"Sales de baño Epson enriquecidas con aceite de árnica y aceite esencial de gaulteria. Sales ricas en Magnesio, unido a los efectos del árnica y la gaulteria potencian sus efectos beneficiosos para músculos y articulaciones. Recomendado para baños completos o parciales.",33.00 EUR,https://anitapinturitas.es/assets/productos/cuidadoPiel/masajista10.jpg,https://anitapinturitas.es/html/producto.html?id=US-51112-10,in stock,new,Anita Pinturitas,El rincón del masajista
hair_spray_termo_protector_30ml,SPRAY TERMO PROTECTOR PROFESIONAL SHIELDY STYLE.ME,Spray termoprotector enriquecido con aceite de argán que crea una película invisible para una protección total del cabello contra las altas temperaturas y la acción del calor. Facilita el planchado y proporciona una acción hidratante y anti-estática para un cabello más suave y luminoso.,14.90 EUR,https://anitapinturitas.es/assets/productos/cuidadoCapilar/spray-termoprotector.jpg,https://anitapinturitas.es/html/producto.html?id=hair_spray_termo_protector_30ml,in stock,new,Anita Pinturitas,Cuidado Capilar
hair_oil_revive_30ml,ACEITE REAVIVA CABELLO PROFESIONAL REVIVE STYLE.ME,"Aceite revitalizante con extracto de quinoa y orquídea que aporta suavidad y elasticidad al cabello. Colabora a la reparación de los cabellos secos y dañados, aportando brillo, sedosidad y un control perfecto del encrespamiento.",14.90 EUR,https://anitapinturitas.es/assets/productos/cuidadoCapilar/aceite-revitalizante.jpg,https://anitapinturitas.es/html/producto.html?id=hair_oil_revive_30ml,in stock,new,Anita Pinturitas,Cuidado Capilar
hair_powder_volume_rootlift,POLVO VOLUMINIZADOR PROFESIONAL DUSTY STYLE.ME,"Voluminizador en polvo ideal para aportar ese extra de volumen y textura al cabello. Destaca por su innovador dosificador, en formato pulsador, para mayor precisión a la hora de aplicar el producto en su cantidad justa. Aplicándolo sobre la raíz del cabello en seco, proporciona un efecto voluminizador instantáneo y de larga duración. Es ideal para texturizar, dar forma y cardar el cabello. Si se aplica en poca cantidad, también puede actuar como champú en seco al eliminar aceites grasos del cabello.",22.90 EUR,https://anitapinturitas.es/assets/productos/cuidadoCapilar/polvo-volumen.jpg,https://anitapinturitas.es/html/producto.html?id=hair_powder_volume_rootlift,in stock,new,Anita Pinturitas,Cuidado Capilar
hair_laca_fijacion_flexible,LACA FUERTE PROFESIONAL SEXY STYLE.ME,"Laca de fijación fuerte y de larga duración, perfecta para aportar volumen a esos peinados que necesitan mantenerse intactos durante todo el día. Protege el cabello de la humedad y lo acondiciona para un peinado natural e intenso.",14.90 EUR,https://anitapinturitas.es/assets/productos/cuidadoCapilar/laca-fijacion.jpg,https://anitapinturitas.es/html/producto.html?id=hair_laca_fijacion_flexible,in stock,new,Anita Pinturitas,Cuidado Capilar
hair_shampoo_fortificante_250ml,Mascarilla Anti-Yellow Style.me,"Repara y fortalece el cabello dañado. Para evitar la desnutrición que causaría perder los lípidos naturales del cabello, Termix ha desarrollado la nueva mascarilla Repair.Me, ideal para cabellos dañados, ya que gracias a su fórmula sin sulfatos ni siliconas repara la fibra capilar y lo mantiene hidratado. Enriquecida con manteca de Karité, Aloe Vera y aceite de Marula, además de un 84% de principios activos naturales, la mascarilla fortalece las fibras capilares, regenera el cabello, y le da un aspecto más bonito y saludable. Combínala con el champú Repair.Me para conseguir una melena más suave, brillante y protegida.",16.00 EUR,https://anitapinturitas.es/assets/productos/cuidadoCapilar/champu-fortificante.jpg,https://anitapinturitas.es/html/producto.html?id=hair_shampoo_fortificante_250ml,in stock,new,Anita Pinturitas,Cuidado Capilar
hair_shampoo_color_250ml,Mascarilla Nutritiva Nutri.me Style.me,"Para un cabello sano y nutrido. La mascarilla Nutri.Me es ideal para cabellos quebradizos, sin elasticidad y sin brillo ya que gracias su fórmula vegana, 100% libre de SLES, parabenos y siliconas deja el pelo nutrido y revitaliza la fibra capilar aportando movimiento de raíz a puntas. Con una textura fundente, tiene propiedades altamente nutritivas y protectoras. Contiene un 85% de ingredientes naturales como la manteca de Karité, el Aloe Vera y el aceite de Marula reestructura la fibra capilar y proporciona una nutrición intensa sin apelmazar el cabello, restaurando además su brillo.",16.00 EUR,https://anitapinturitas.es/assets/productos/cuidadoCapilar/champu-color.jpg,https://anitapinturitas.es/html/producto.html?id=hair_shampoo_color_250ml,in stock,new,Anita Pinturitas,Cuidado Capilar
hair_shampoo_antiedad_250ml,Champú Antiyellow.Me Style.Me,"Reaviva y transforma el tono del cabello. Termix presenta su primera línea de champús y mascarillas veganas AntiYellow.Me de Style.Me para cabellos rubios, decolorados o con canas formulada para neutralizar los tonos subyacentes amarillos no deseados. Gracias a su fórmula natural, libre de SLES, y enriquecida con Aloe Vera, Aceite de Marula y pigmentos violetas, mantiene el rubio frío neutralizando los tonos subyacentes cálidos, previniendo la pérdida de color y realzando su intensidad. Compuesto por un 88% de ingredientes de origen natural, el champú AntiYellow.Me está enriquecida con ingredientes como el Aloe Vera, el aceite de Marula y pigmentos violetas para limpiar con suavidad las impurezas del cuero cabelludo y eliminar de forma instantánea los tonos subyacentes amarillos no deseados.",13.00 EUR,https://anitapinturitas.es/assets/productos/cuidadoCapilar/champu-antiedad.jpg,https://anitapinturitas.es/html/producto.html?id=hair_shampoo_antiedad_250ml,in stock,new,Anita Pinturitas,Cuidado Capilar
hair_mascarilla_reparadora_200ml,Champú nutritivo Nutri.Me Style.Me,"Cuidado desde la raíz hasta las puntas. Dale a tu cabello una dosis de fuerza, suavidad y vitalidad con el champú Nutri.Me, que nutre profundamente la fibra capilar desde el interior a la vez que previene la rotura del cabello y las puntas abiertas. Compuesto por un 88% de ingredientes de origen natural, su fórmula nutritiva a base de Aloe Vera, aceite de Marula y Provitamina B5, elimina el encrespamiento y aporta la nutrición que el cabello necesita a la vez que elimina con suavidad las impurezas del cuero cabelludo.",13.00 EUR,https://anitapinturitas.es/assets/productos/cuidadoCapilar/mascarilla-reparadora.jpg,https://anitapinturitas.es/html/producto.html?id=hair_mascarilla_reparadora_200ml,in stock,new,Anita Pinturitas,Cuidado Capilar
hair_mascarilla_hidratante_200ml,Champú reparador Repair.Me Style.Me,"¿List@ para revivir tu melena? Termix presenta su primera línea de champús veganos Repair.Me de Style.Me con tecnología natural que repara y fortalece el cabello dañado. Con un 88% de principios activos naturales, su fórmula sin SLES está enriquecida con Aloe Vera y Aceite de Marula para regenerar el cabello, revitalizarlo y devolverle un aspecto saludable y brillante. Diseñado para cabellos secos y dañados, limpia en profundidad el cuero cabelludo a la vez que restaura los cabellos más dañados. ¡Devuélvele la vida a tu cabello!",13.00 EUR,https://anitapinturitas.es/assets/productos/cuidadoCapilar/mascarilla-hidratante.jpg,https://anitapinturitas.es/html/producto.html?id=hair_mascarilla_hidratante_200ml,in stock,new,Anita Pinturitas,Cuidado Capilar
hair_mascarilla_brillo_150ml,Mascarilla reparadora Repair.me Style.me,"Repara y fortalece el cabello dañado.Para evitar la desnutrición que causaría perder los lípidos naturales del cabello, Termix ha desarrollado la nueva mascarilla Repair.Me, ideal para cabellos dañados, ya que gracias a su fórmula sin sulfatos ni siliconas repara la fibra capilar y lo mantiene hidratado. Enriquecida con manteca de Karité, Aloe Vera y aceite de Marula, además de un 84% de principios activos naturales, la mascarilla fortalece las fibras capilares, regenera el cabello, y le da un aspecto más bonito y saludable. Combínala con el champú Repair.Me para conseguir una melena más suave, brillante y protegida.",16.00 EUR,https://anitapinturitas.es/assets/productos/cuidadoCapilar/mascarilla-brillo.jpg,https://anitapinturitas.es/html/producto.html?id=hair_mascarilla_brillo_150ml,in stock,new,Anita Pinturitas,Cuidado Capilar